trial, epigraphRestored, ave_fitness, ave_generations, num_runs, population_size, generations, crossover_rate, mutation_rate, elite_size, improveThresh, stagThresh,best_epigraph,ave_fitness,ave_generations,population_size,generations,crossover_rate,mutation_rate,elite_size,num_runs,improveThresh,stagThresh
14, το αλεξανδρε ουδις πολιν,0.6562650463781418,100.0,10.0,20.0,100.0,0.7,0.01,1.0,0.0,100.0,,,,,,,,,,,
15, καλου αλεξανδρε ουδις ως,0.6002772602065771,53.1,10.0,20.0,1000.0,0.6,0.01,1.0,0.01,50.0,,,,,,,,,,,
16, τυρα αλεξανδρε ουδις υπατων,0.596508659347611,51.3,10.0,20.0,1000.0,0.6,0.01,1.0,0.01,50.0,,,,,,,,,,,
17, μα αλεξανδρε ουδις κυριε,0.6216631523574272,52.0,10.0,20.0,1000.0,0.6,0.1,1.0,0.01,50.0,,,,,,,,,,,
18, δυστρου αλεξανδρε ουδις δη,0.5971269626619611,51.4,10.0,20.0,1000.0,0.9,0.01,1.0,0.01,50.0,,,,,,,,,,,
19, ημων αλεξανδρε ουδις ως,0.5843699745019888,51.3,10.0,20.0,1000.0,0.1,0.01,1.0,0.01,50.0,,,,,,,,,,,
20, μνημιον αλεξανδρε ουδις το,0.8080907418021825,54.4,10.0,200.0,1000.0,0.6,0.01,1.0,0.01,50.0,,,,,,,,,,,
21, και αλεξανδρε ουδις των,0.8238550485643437,54.4,10.0,200.0,1000.0,0.6,0.01,1.0,0.01,50.0,,,,,,,,,,,
22, του αλεξανδρε ουδις ου,0.798853356471579,53.8,10.0,200.0,1000.0,0.6,0.1,1.0,0.01,50.0,,,,,,,,,,,
23, εν αλεξανδρε ουδις ετων,0.7515134940545256,53.1,10.0,200.0,1000.0,0.9,0.01,1.0,0.01,50.0,,,,,,,,,,,
24, ετους αλεξανδρε ουδις επι,0.8283253652065001,56.0,10.0,200.0,1000.0,0.1,0.01,1.0,0.01,50.0,,,,,,,,,,,
25, ου αλεξανδρε ουδις τριων,0.6015286354210329,51.02,100.0,20.0,500.0,0.6,0.01,1.0,0.1,50.0,,,,,,,,,,,
26, επι αλεξανδρε ουδις ινδικτιωνος,0.8903056921117773,105.41,100.0,500.0,1000.0,0.1,0.01,2.0,0.001,100.0,,,,,,,,,,,
27, και αλεξανδρε ουδις ετους,0.9609934384332124,53.88,50.0,1000.0,250.0,0.9,0.05,10.0,0.01,50.0,,,,,,,,,,,
28, ετους αλεξανδρε ουδις τω,0.7208503032859198,53.52,50.0,100.0,250.0,0.3,0.05,1.0,0.001,50.0,,,,,,,,,,,
29, ουδις αλεξανδρε ουδις ουδις,0.7309777196583338,24.3,10.0,100.0,1000.0,0.1,0.1,1.0,0.001,20.0,,,,,,,,,,,
30, ουδις αλεξανδρε ουδις ουδις,0.8430382951035569,103.7,10.0,250.0,250.0,0.6,0.05,10.0,0.01,100.0,,,,,,,,,,,
31, εις αλεξανδρε ουδις και,0.7875119017658885,104.59,100.0,200.0,1000.0,0.3,0.01,2.0,0.001,100.0,,,,,,,,,,,
32, ετων αλεξανδρε ουδις ου,0.7967752671794596,51.17,100.0,200.0,500.0,0.3,0.1,2.0,0.1,50.0,,,,,,,,,,,
33, ινδικτιωνος αλεξανδρε ουδις εις,0.9135351100229556,21.1,50.0,500.0,1000.0,0.3,0.01,5.0,0.1,20.0,,,,,,,,,,,
34, ουδις αλεξανδρε ουδις ουδις,0.8048817302470228,51.3,100.0,200.0,250.0,0.1,0.1,10.0,0.1,50.0,,,,,,,,,,,
35, τα αλεξανδρε ουδις κυριου,0.6193888387917221,101.44,25.0,20.0,1000.0,0.3,0.1,1.0,0.1,100.0,,,,,,,,,,,
36, ουδις αλεξανδρε ουδις ουδις,0.7629336458898319,23.07,100.0,100.0,250.0,0.6,0.1,10.0,0.01,20.0,,,,,,,,,,,
37, της αλεξανδρε ουδις μηνι,0.6895615388115793,21.12,100.0,50.0,1000.0,0.3,0.1,2.0,0.1,20.0,,,,,,,,,,,
38, ουδις αλεξανδρε ουδις ουδις,0.879482002502165,105.0,10.0,500.0,500.0,0.1,0.01,5.0,0.01,100.0,,,,,,,,,,,
39, μηνι αλεξανδρε ουδις εν,0.7450813618647882,54.0,25.0,100.0,1000.0,0.1,0.1,5.0,0.001,50.0,,,,,,,,,,,
40, νου αλεξανδρε ουδις μοκιμου,0.5923003536841713,51.6,10.0,20.0,1000.0,0.6,0.01,1.0,0.01,50.0,,,,,,,,,,,
41, θεοφιλεστατου αλεξανδρε ουδις αθανατος,0.5861365441892157,51.4,10.0,20.0,1000.0,0.6,0.01,1.0,0.01,50.0,,,,,,,,,,,
42, ρωμαιων αλεξανδρε ουδις εχει,0.6133586739089276,51.8,10.0,20.0,1000.0,0.6,0.1,1.0,0.01,50.0,,,,,,,,,,,
43, του αλεξανδρε ουδις του,0.6095233601483432,53.7,10.0,20.0,1000.0,0.9,0.01,1.0,0.01,50.0,,,,,,,,,,,
44, ου αλεξανδρε ουδις ταξαν,0.5943805234501733,55.2,10.0,20.0,1000.0,0.1,0.01,1.0,0.01,50.0,,,,,,,,,,,
45, ουδις αλεξανδρε ουδις ουδις,0.7915318756103354,55.0,10.0,200.0,1000.0,0.6,0.01,1.0,0.01,50.0,,,,,,,,,,,
46, μηνι αλεξανδρε ουδις την,0.7306495134323516,53.8,10.0,200.0,1000.0,0.6,0.01,1.0,0.01,50.0,,,,,,,,,,,
47, ινδικτιωνος αλεξανδρε ουδις και,0.7900775742216404,54.0,10.0,200.0,1000.0,0.6,0.1,1.0,0.01,50.0,,,,,,,,,,,
48, ετους αλεξανδρε ουδις ημων,0.7812763568502283,53.6,10.0,200.0,1000.0,0.9,0.01,1.0,0.01,50.0,,,,,,,,,,,
49, ετων αλεξανδρε ουδις ος,0.7632285522438507,55.7,10.0,200.0,1000.0,0.1,0.01,1.0,0.01,50.0,,,,,,,,,,,
50, ετων αλεξανδρε ουδις ετους,0.7164334700101098,103.48,50.0,100.0,250.0,0.3,0.1,1.0,0.01,100.0,,,,,,,,,,,
51, και αλεξανδρε ουδις και,0.6872195513529862,101.16,100.0,50.0,1000.0,0.6,0.01,1.0,0.1,100.0,,,,,,,,,,,
52, ινδικτιωνος αλεξανδρε ουδις απο,0.7197592709056019,51.0,25.0,100.0,250.0,0.1,0.01,1.0,0.1,50.0,,,,,,,,,,,
53, και αλεξανδρε ουδις ετους,0.8847639471798882,104.3,10.0,1000.0,500.0,0.6,0.05,1.0,0.001,100.0,,,,,,,,,,,
54, δε αλεξανδρε ουδις κα,0.7201350426216047,104.3,50.0,100.0,1000.0,0.1,0.1,1.0,0.001,100.0,,,,,,,,,,,
55, μνημιον αλεξανδρε ουδις μηνος,0.779254493568896,55.6,10.0,200.0,500.0,0.1,0.01,2.0,0.01,50.0,,,,,,,,,,,
56, τω αλεξανδρε ουδις ηγουμενου,0.6467079800871635,25.1,10.0,50.0,250.0,0.1,0.05,1.0,0.001,20.0,,,,,,,,,,,
57, εις αλεξανδρε ουδις του,0.688564452015812,23.07,100.0,50.0,500.0,0.6,0.05,1.0,0.01,20.0,,,,,,,,,,,
58, του αλεξανδρε ουδις και,0.8101997144058302,104.44,25.0,250.0,500.0,0.3,0.01,1.0,0.01,100.0,,,,,,,,,,,
59, ουδις αλεξανδρε ουδις ουδις,0.8972785480170122,54.5,10.0,500.0,500.0,0.3,0.01,1.0,0.01,50.0,,,,,,,,,,,
60, τω αλεξανδρε ουδις της,0.67087927706568,51.09,100.0,50.0,1000.0,0.6,0.01,10.0,0.1,50.0,,,,,,,,,,,
61, και αλεξανδρε ουδις και,0.7198145889523743,23.96,25.0,100.0,1000.0,0.1,0.1,5.0,0.01,20.0,,,,,,,,,,,
62, ετους αλεξανδρε ουδις ος,0.8279322532172901,23.7,50.0,250.0,500.0,0.9,0.01,1.0,0.01,20.0,,,,,,,,,,,
63, ετει αλεξανδρε ουδις ιων,0.6469623943620897,22.68,25.0,20.0,250.0,0.9,0.1,1.0,0.01,20.0,,,,,,,,,,,
64, ου αλεξανδρε ουδις της,0.7202326981724932,103.57,100.0,100.0,1000.0,0.6,0.01,2.0,0.01,100.0,,,,,,,,,,,
65, ουδις αλεξανδρε ουδις ουδις,0.7938804623500277,101.14,50.0,200.0,500.0,0.3,0.01,1.0,0.1,100.0,,,,,,,,,,,
66, ετους αλεξανδρε ουδις ετους,0.6743158606833388,52.58,50.0,50.0,500.0,0.9,0.05,2.0,0.01,50.0,,,,,,,,,,,
67, ινδικτιωνος αλεξανδρε ουδις του,0.9377030994551186,104.78,100.0,1000.0,250.0,0.6,0.01,2.0,0.01,100.0,,,,,,,,,,,
68, μηνι αλεξανδρε ουδις τε,0.6916990325219912,101.26,100.0,50.0,500.0,0.9,0.01,10.0,0.1,100.0,,,,,,,,,,,
69, δια αλεξανδρε ουδις αι,0.6347386815829414,21.0,10.0,50.0,250.0,0.9,0.01,2.0,0.1,20.0,,,,,,,,,,,
70, του αλεξανδρε ουδις εν,0.8871104213823756,104.8,10.0,200.0,500.0,0.6,0.01,10.0,0.01,100.0,,,,,,,,,,,
71, ουδις αλεξανδρε ουδις ουδις,0.9121679952779834,23.84,25.0,1000.0,1000.0,0.6,0.05,10.0,0.01,20.0,,,,,,,,,,,
72, ουδις αλεξανδρε ουδις ουδις,0.8649062083562672,104.47,100.0,500.0,250.0,0.1,0.1,2.0,0.01,100.0,,,,,,,,,,,
73, ινδικτιωνος αλεξανδρε ουδις εν,0.7962809215368786,51.16,50.0,200.0,1000.0,0.9,0.01,1.0,0.1,50.0,,,,,,,,,,,
74, αυτου αλεξανδρε ουδις δια,0.7235200583296277,51.13,100.0,100.0,250.0,0.6,0.05,1.0,0.1,50.0,,,,,,,,,,,
75, γυναικος αλεξανδρε ουδις τε,0.5852852829715087,102.5,10.0,20.0,1000.0,0.3,0.01,5.0,0.001,100.0,,,,,,,,,,,
76, ετους αλεξανδρε ουδις και,0.8795513427849059,23.84,100.0,500.0,1000.0,0.6,0.1,5.0,0.01,20.0,,,,,,,,,,,
77, ουδις αλεξανδρε ουδις ουδις,0.8742656919709555,101.12,25.0,500.0,500.0,0.9,0.01,5.0,0.1,100.0,,,,,,,,,,,
78, ουδις αλεξανδρε ουδις ουδις,0.6746123873424934,53.05,100.0,50.0,500.0,0.3,0.1,5.0,0.001,50.0,,,,,,,,,,,
77,μη αλεξανδρε ουδις στο,0.8742656919709555,101.12,500.0,500.0,0.9,0.01,5.0,25.0,0.1,100.0,,,,,,,,,,,
78,επταμηνου αλεξανδρε ουδις παις,0.6746123873424934,53.05,50.0,500.0,0.3,0.1,5.0,100.0,0.001,50.0,,,,,,,,,,,
81, υτοκρατωρ αλεξανδρε ουδις των,0.6581649683155679,23.42,100.0,50.0,500.0,0.1,0.05,2.0,0.01,20.0,,,,,,,,,,,
82, υς αλεξανδρε ουδις απο,0.6097381811648523,21.3,10.0,20.0,500.0,0.1,0.01,2.0,0.01,20.0,,,,,,,,,,,
83, στεφανου αλεξανδρε ουδις ονοματος,0.6021434612395737,52.48,50.0,20.0,500.0,0.1,0.05,1.0,0.001,50.0,,,,,,,,,,,
84, τας αλεξανδρε ουδις αποθανοντος,0.6825979447303816,23.12,25.0,50.0,250.0,0.6,0.1,10.0,0.01,20.0,,,,,,,,,,,
85, δια αλεξανδρε ουδις ζαρανα,0.6140858491107581,52.38,100.0,20.0,500.0,0.1,0.1,1.0,0.001,50.0,,,,,,,,,,,
86, αυ αλεξανδρε ουδις υπ,0.5984832113297773,21.0,10.0,20.0,250.0,0.9,0.1,2.0,0.1,20.0,,,,,,,,,,,
87, επι αλεξανδρε ουδις του,0.7577190874172554,104.7,10.0,250.0,1000.0,0.1,0.01,5.0,0.001,100.0,,,,,,,,,,,
88, ετους αλεξανδρε ουδις επι,0.7380039221421145,23.08,50.0,100.0,1000.0,0.9,0.05,1.0,0.001,20.0,,,,,,,,,,,
89, ουδις αλεξανδρε ουδις ουδις,0.9251792201607236,104.3,10.0,1000.0,250.0,0.9,0.01,1.0,0.01,100.0,,,,,,,,,,,
90, ινδικτιωνος αλεξανδρε ουδις και,0.8392916409824647,54.9,10.0,500.0,500.0,0.1,0.05,1.0,0.001,50.0,,,,,,,,,,,
79, οις αλεξανδρε ουδις εμμιςης,0.6581649683155679,23.42,50.0,500.0,0.1,0.05,2.0,100.0,0.01,20.0,,,,,,,,,,,
80, ηριστευκοτα αλεξανδρε ουδις πανδοκειον,0.6097381811648523,21.3,20.0,500.0,0.1,0.0,2.0,10.0,0.01,20.0,,,,,,,,,,,
81, εισην αλεξανδρε ουδις νικης,0.6021434612395737,52.48,20.0,500.0,0.1,0.05,0.0,50.0,0.001,50.0,,,,,,,,,,,
82, αυσσεβδου αλεξανδρε ουδις μαλχη,0.6825979447303816,23.12,50.0,250.0,0.6,0.1,10.0,25.0,0.01,20.0,,,,,,,,,,,
83, ευνοιας αλεξανδρε ουδις παρεσχημενον,0.6140858491107581,52.38,20.0,500.0,0.1,0.1,0.0,100.0,0.001,50.0,,,,,,,,,,,
84, μαλη αλεξανδρε ουδις προνοια,0.5984832113297773,21.0,20.0,250.0,0.9,0.1,2.0,10.0,0.1,20.0,,,,,,,,,,,
85, οεωνιον αλεξανδρε ουδις δεξιοις,0.7577190874172554,104.7,250.0,1000.0,0.1,0.0,5.0,10.0,0.001,100.0,,,,,,,,,,,
86, θελωσιν αλεξανδρε ουδις χωριω,0.7380039221421145,23.08,100.0,1000.0,0.9,0.05,1.0,50.0,0.001,20.0,,,,,,,,,,,
87, πεπαυμε αλεξανδρε ουδις παν,0.9251792201607236,104.3,1000.0,250.0,0.9,0.0,0.0,10.0,0.01,100.0,,,,,,,,,,,
88, επταμηνου αλεξανδρε ουδις αθανα,0.8392916409824647,54.9,500.0,500.0,0.1,0.05,1.0,10.0,0.001,50.0,,,,,,,,,,,
89, επι αλεξανδρε ουδις και,0.7057376383660392,52.8,10.0,100.0,1000.0,0.6,0.05,5.0,0.01,50.0,,,,,,,,,,,
91, ουδις αλεξανδρε ουδις ουδις,0.9830881375020472,105.7,10.0,1000.0,250.0,0.1,0.01,5.0,0.001,100.0,,,,,,,,,,,
92, ουδις αλεξανδρε ουδις ουδις,0.8917395111136261,26.066666666666663,15.0,500.0,500.0,0.1,0.01,1.0,0.01,20.0,,,,,,,,,,,
93, ετει αλεξανδρε ουδις κα,0.6681790142452352,53.3,10.0,50.0,1000.0,0.9,0.1,1.0,0.01,50.0,,,,,,,,,,,
94, ινδικτιωνος αλεξανδρε ουδις του,0.9088885304245083,104.26666666666668,15.0,500.0,250.0,0.3,0.05,1.0,0.001,100.0,,,,,,,,,,,
95, ουδις αλεξανδρε ουδις ουδις,0.9361612698331968,51.12,25.0,1000.0,250.0,0.6,0.1,10.0,0.1,50.0,,,,,,,,,,,
96, ου αλεξανδρε ουδις επι,0.803850102433582,101.0,10.0,250.0,1000.0,0.6,0.01,2.0,0.1,100.0,,,,,,,,,,,
97, τους αλεξανδρε ουδις αι,0.7328033259486169,51.04,25.0,100.0,250.0,0.6,0.01,10.0,0.1,50.0,,,,,,,,,,,
98, ποις αλεξανδρε ουδις οι,0.6192676134133273,21.0,10.0,20.0,1000.0,0.3,0.05,1.0,0.1,20.0,,,,,,,,,,,
99, ου αλεξανδρε ουδις του,0.8030175130896205,21.2,25.0,250.0,250.0,0.3,0.1,1.0,0.1,20.0,,,,,,,,,,,
100, την αλεξανδρε ουδις τον,0.635108721289276,21.0,15.0,20.0,500.0,0.9,0.01,2.0,0.1,20.0,,,,,,,,,,,
91, αγενειων αλεξανδρε ουδις αρτεμισιου,0.9830881375020472,105.7,1000.0,250.0,0.1,0.0,5.0,10.0,0.001,100.0,,,,,,,,,,,
92, ιλλουστριου αλεξανδρε ουδις δασιος,0.8917395111136261,26.066666666666663,500.0,500.0,0.1,0.01,0.0,15.0,0.01,20.0,,,,,,,,,,,
93, πατρος αλεξανδρε ουδις δικαισιν,0.6681790142452352,53.3,50.0,1000.0,0.9,0.1,1.0,10.0,0.01,50.0,,,,,,,,,,,
94, βαρλαας αλεξανδρε ουδις τεκνοις,0.9088885304245083,104.26666666666668,500.0,250.0,0.3,0.05,0.0,15.0,0.001,100.0,,,,,,,,,,,
95, ερως αλεξανδρε ουδις αντικερασος,0.9361612698331968,51.12,1000.0,250.0,0.6,0.1,10.0,25.0,0.1,50.0,,,,,,,,,,,
96, ριαι αλεξανδρε ουδις δυο,0.803850102433582,101.0,250.0,1000.0,0.6,0.0,2.0,10.0,0.1,100.0,,,,,,,,,,,
97, ευξομενος αλεξανδρε ουδις οιηι,0.7328033259486169,51.04,100.0,250.0,0.6,0.0,10.0,25.0,0.1,50.0,,,,,,,,,,,
98, ελιου αλεξανδρε ουδις τεροις,0.6192676134133273,21.0,20.0,1000.0,0.3,0.05,0.0,10.0,0.1,20.0,,,,,,,,,,,
99, επιγαμιαν αλεξανδρε ουδις ουετιου,0.8030175130896205,21.2,250.0,250.0,0.3,0.1,0.0,25.0,0.1,20.0,,,,,,,,,,,
100, παρουσιν αλεξανδρε ουδις ουαλεντινος,0.635108721289276,21.0,20.0,500.0,0.9,0.01,2.0,15.0,0.1,20.0,,,,,,,,,,,
101, ου αλεξανδρε ουδις ετων,0.6039033575034193,21.5,10.0,20.0,100.0,0.6,0.01,1.0,0.01,20.0,,,,,,,,,,,
102, εν αλεξανδρε ουδις της,0.7161511575155984,23.3,10.0,100.0,1000.0,0.6,0.1,1.0,0.01,20.0,,,,,,,,,,,
103, θαυματουργου αλεξανδρε ουδις κυριε,0.6510222139747973,54.1,10.0,20.0,1000.0,0.6,0.01,1.0,0.01,50.0,,,,,,,,,,,
104, εν αλεξανδρε ουδις οι,0.6074876161534518,55.5,10.0,20.0,1000.0,0.6,0.01,1.0,0.01,50.0,,,,,,,,,,,
105, τη αλεξανδρε ουδις βο,0.6108497689738164,52.3,10.0,20.0,1000.0,0.6,0.1,1.0,0.01,50.0,,,,,,,,,,,
106, ετων αλεξανδρε ουδις ου,0.6254533617796791,56.2,10.0,20.0,1000.0,0.9,0.01,1.0,0.01,50.0,,,,,,,,,,,
107, λογους αλεξανδρε ουδις παντων,0.6068257608449398,52.7,10.0,20.0,1000.0,0.1,0.01,1.0,0.01,50.0,,,,,,,,,,,
108, μηνι αλεξανδρε ουδις μηνος,0.7575167074661315,53.0,10.0,200.0,1000.0,0.6,0.01,1.0,0.01,50.0,,,,,,,,,,,
109, ετους αλεξανδρε ουδις εν,0.7895132612067818,53.9,10.0,200.0,1000.0,0.6,0.01,1.0,0.01,50.0,,,,,,,,,,,
110, των αλεξανδρε ουδις εις,0.7774873076587051,53.2,10.0,200.0,1000.0,0.6,0.1,1.0,0.01,50.0,,,,,,,,,,,
111, ος αλεξανδρε ουδις των,0.7809397114858327,53.6,10.0,200.0,1000.0,0.9,0.01,1.0,0.01,50.0,,,,,,,,,,,
112, ουδις αλεξανδρε ουδις ουδις,0.81447708954212,57.3,10.0,200.0,1000.0,0.1,0.01,1.0,0.01,50.0,,,,,,,,,,,
103,,,,,,,,,,,,θαυματουργου αλεξανδρε ουδις κυριε,0.6510222139747973,54.1,20.0,1000.0,0.6,0.0,1.0,10.0,0.01,50.0
104,,,,,,,,,,,,εν αλεξανδρε ουδις οι,0.6074876161534518,55.5,20.0,1000.0,0.6,0.01,1.0,10.0,0.01,50.0
105,,,,,,,,,,,,τη αλεξανδρε ουδις βο,0.6108497689738164,52.3,20.0,1000.0,0.6,0.1,1.0,10.0,0.01,50.0
106,,,,,,,,,,,,ετων αλεξανδρε ουδις ου,0.6254533617796791,56.2,20.0,1000.0,0.9,0.01,1.0,10.0,0.01,50.0
107,,,,,,,,,,,,λογους αλεξανδρε ουδις παντων,0.6068257608449398,52.7,20.0,1000.0,0.1,0.01,1.0,10.0,0.01,50.0
108,,,,,,,,,,,,μηνι αλεξανδρε ουδις μηνος,0.7575167074661315,53.0,200.0,1000.0,0.6,0.0,1.0,10.0,0.01,50.0
109,,,,,,,,,,,,ετους αλεξανδρε ουδις εν,0.7895132612067818,53.9,200.0,1000.0,0.6,0.01,1.0,10.0,0.01,50.0
110,,,,,,,,,,,,των αλεξανδρε ουδις εις,0.7774873076587051,53.2,200.0,1000.0,0.6,0.1,1.0,10.0,0.01,50.0
111,,,,,,,,,,,,ος αλεξανδρε ουδις των,0.7809397114858327,53.6,200.0,1000.0,0.9,0.01,1.0,10.0,0.01,50.0
112,,,,,,,,,,,,ουδις αλεξανδρε ουδις ουδις,0.81447708954212,57.3,200.0,1000.0,0.1,0.01,1.0,10.0,0.01,50.0
113, ουδις αλεξανδρε ουδις ουδις,0.9042481342432164,23.84,25.0,500.0,250.0,0.9,0.05,10.0,0.01,20.0,,,,,,,,,,,
114, εις αλεξανδρε ουδις τω,0.7391357541671505,103.4,10.0,200.0,1000.0,0.3,0.01,5.0,0.001,100.0,,,,,,,,,,,
115, ετων αλεξανδρε ουδις μηνι,0.6695262700949737,54.53333333333333,15.0,50.0,1000.0,0.3,0.01,1.0,0.01,50.0,,,,,,,,,,,
116, ουδις αλεξανδρε ουδις ουδις,0.7954539103261147,101.0,10.0,250.0,500.0,0.3,0.01,1.0,0.1,100.0,,,,,,,,,,,
117, ετους αλεξανδρε ουδις ου,0.8135569782494277,51.53333333333333,15.0,250.0,250.0,0.1,0.01,10.0,0.1,50.0,,,,,,,,,,,
118, και αλεξανδρε ουδις των,0.8527210483112895,24.84,25.0,250.0,250.0,0.1,0.1,5.0,0.001,20.0,,,,,,,,,,,
119, ουδις αλεξανδρε ουδις ουδις,0.958727788372056,25.5,10.0,1000.0,1000.0,0.3,0.01,2.0,0.01,20.0,,,,,,,,,,,
120, και αλεξανδρε ουδις των,0.8933016824694227,23.2,10.0,500.0,250.0,0.9,0.1,2.0,0.01,20.0,,,,,,,,,,,
121, και αλεξανδρε ουδις του,0.8770859760597416,54.0,10.0,500.0,1000.0,0.9,0.1,1.0,0.001,50.0,,,,,,,,,,,
122, ουδις αλεξανδρε ουδις ουδις,0.8663502730795449,104.6,25.0,500.0,500.0,0.6,0.01,2.0,0.001,100.0,,,,,,,,,,,
123, ουδις αλεξανδρε ουδις ουδις,0.7807893829932713,51.333333333333336,15.0,250.0,250.0,0.6,0.01,1.0,0.1,50.0,,,,,,,,,,,
124, ος αλεξανδρε ουδις δια,0.8046680342366355,21.28,25.0,250.0,500.0,0.1,0.01,10.0,0.1,20.0,,,,,,,,,,,
125, και αλεξανδρε ουδις ετους,0.9661762750040946,21.1,10.0,1000.0,500.0,0.6,0.1,10.0,0.1,20.0,,,,,,,,,,,
126, τους αλεξανδρε ουδις το,0.7820988528687807,101.4,10.0,200.0,1000.0,0.9,0.01,10.0,0.1,100.0,,,,,,,,,,,
127, εκ αλεξανδρε ουδις μηνος,0.7457092988562618,101.1,10.0,100.0,250.0,0.6,0.05,2.0,0.1,100.0,,,,,,,,,,,
113,,,,,,,,,,,,ουδις αλεξανδρε ουδις ουδις,0.9042481342432164,23.84,500.0,250.0,0.9,0.05,10.0,25.0,0.01,20.0
114,,,,,,,,,,,,εις αλεξανδρε ουδις τω,0.7391357541671505,103.4,200.0,1000.0,0.3,0.01,5.0,10.0,0.001,100.0
115,,,,,,,,,,,,ετων αλεξανδρε ουδις μηνι,0.6695262700949737,54.53333333333333,50.0,1000.0,0.3,0.01,1.0,15.0,0.01,50.0
116,,,,,,,,,,,,ουδις αλεξανδρε ουδις ουδις,0.7954539103261147,101.0,250.0,500.0,0.3,0.01,0.0,10.0,0.1,100.0
117,,,,,,,,,,,,ετους αλεξανδρε ουδις ου,0.8135569782494277,51.53333333333333,250.0,250.0,0.1,0.0,10.0,15.0,0.1,50.0
118,,,,,,,,,,,,και αλεξανδρε ουδις των,0.8527210483112895,24.84,250.0,250.0,0.1,0.1,5.0,25.0,0.001,20.0
119,,,,,,,,,,,,ουδις αλεξανδρε ουδις ουδις,0.958727788372056,25.5,1000.0,1000.0,0.3,0.0,2.0,10.0,0.01,20.0
120,,,,,,,,,,,,και αλεξανδρε ουδις των,0.8933016824694227,23.2,500.0,250.0,0.9,0.1,2.0,10.0,0.01,20.0
121,,,,,,,,,,,,και αλεξανδρε ουδις του,0.8770859760597416,54.0,500.0,1000.0,0.9,0.1,0.0,10.0,0.001,50.0
122,,,,,,,,,,,,ουδις αλεξανδρε ουδις ουδις,0.8663502730795449,104.6,500.0,500.0,0.6,0.0,2.0,25.0,0.001,100.0
123,,,,,,,,,,,,ουδις αλεξανδρε ουδις ουδις,0.7807893829932713,51.333333333333336,250.0,250.0,0.6,0.0,0.0,15.0,0.1,50.0
124,,,,,,,,,,,,ος αλεξανδρε ουδις δια,0.8046680342366355,21.28,250.0,500.0,0.1,0.0,10.0,25.0,0.1,20.0
125,,,,,,,,,,,,και αλεξανδρε ουδις ετους,0.9661762750040946,21.1,1000.0,500.0,0.6,0.1,10.0,10.0,0.1,20.0
126,,,,,,,,,,,,τους αλεξανδρε ουδις το,0.7820988528687807,101.4,200.0,1000.0,0.9,0.01,10.0,10.0,0.1,100.0
127,,,,,,,,,,,,εκ αλεξανδρε ουδις μηνος,0.7457092988562618,101.1,100.0,250.0,0.6,0.05,2.0,10.0,0.1,100.0
128, μνημιον αλεξανδρε ουδις μηνος,0.7081217589845858,28.3,10.0,100.0,1000.0,0.6,0.01,1.0,0.01,25.0,,,,,,,,,,,
129, εν αλεξανδρε ουδις ετους,0.8908247174973586,54.48,25.0,500.0,500.0,0.3,0.1,1.0,0.001,50.0,,,,,,,,,,,
130, αγιο αλεξανδρε ουδις εκτισθη,0.6245782895609261,22.16,25.0,20.0,1000.0,0.1,0.1,1.0,0.1,20.0,,,,,,,,,,,
129,,,,,,,,,,,,εν αλεξανδρε ουδις ετους,0.8908247174973586,54.48,500.0,500.0,0.3,0.1,0.0,25.0,0.001,50.0
130,,,,,,,,,,,,αγιο αλεξανδρε ουδις εκτισθη,0.6245782895609261,22.16,20.0,1000.0,0.1,0.1,0.0,25.0,0.1,20.0
131, ουδις αλεξανδρε ουδις ουδις,0.828099206547428,104.3,10.0,200.0,500.0,0.1,0.05,1.0,0.01,100.0,,,,,,,,,,,
132, αυτου αλεξανδρε ουδις ετων,0.7236924615008519,103.96,25.0,100.0,1000.0,0.9,0.01,5.0,0.001,100.0,,,,,,,,,,,
131,,,,,,,,,,,,ουδις αλεξανδρε ουδις ουδις,0.828099206547428,104.3,200.0,500.0,0.1,0.05,1.0,10.0,0.01,100.0
132,,,,,,,,,,,,αυτου αλεξανδρε ουδις ετων,0.7236924615008519,103.96,100.0,1000.0,0.9,0.0,5.0,25.0,0.001,100.0
133, αι αλεξανδρε ουδις ετη,0.5988692109188081,54.53333333333333,15.0,20.0,250.0,0.6,0.01,2.0,0.001,50.0,,,,,,,,,,,
134, αλυπε αλεξανδρε ουδις αουαιου,0.6164800714083627,54.2,10.0,20.0,1000.0,0.1,0.05,5.0,0.001,50.0,,,,,,,,,,,
133,,,,,,,,,,,,αι αλεξανδρε ουδις ετη,0.5988692109188081,54.53333333333333,20.0,250.0,0.6,0.01,2.0,15.0,0.001,50.0
134,,,,,,,,,,,,αλυπε αλεξανδρε ουδις αουαιου,0.6164800714083627,54.2,20.0,1000.0,0.1,0.05,5.0,10.0,0.001,50.0
135, ουδις αλεξανδρε ουδις ουδις,0.8231856316361665,54.4,15.0,500.0,250.0,0.1,0.1,1.0,0.01,50.0,,,,,,,,,,,
136, μετα αλεξανδρε ουδις μηνι,0.7039139456464872,101.0,10.0,100.0,500.0,0.1,0.1,2.0,0.1,100.0,,,,,,,,,,,
135,,,,,,,,,,,,ουδις αλεξανδρε ουδις ουδις,0.8231856316361665,54.4,500.0,250.0,0.1,0.1,0.0,15.0,0.01,50.0
136,,,,,,,,,,,,μετα αλεξανδρε ουδις μηνι,0.7039139456464872,101.0,100.0,500.0,0.1,0.1,2.0,10.0,0.1,100.0
137, ετους αλεξανδρε ουδις και,0.9296461939249978,51.1,10.0,1000.0,500.0,0.6,0.01,5.0,0.1,50.0,,,,,,,,,,,
138, ουδις αλεξανδρε ουδις ουδις,0.9100854715154028,54.84,25.0,1000.0,500.0,0.1,0.1,1.0,0.01,50.0,,,,,,,,,,,
139, εχει αλεξανδρε ουδις παρα,0.6059897233570471,21.6,10.0,20.0,1000.0,0.6,0.05,1.0,0.01,20.0,,,,,,,,,,,
140, ετων αλεξανδρε ουδις δε,0.698152160693039,101.2,10.0,100.0,250.0,0.1,0.01,2.0,0.1,100.0,,,,,,,,,,,
141, εκτισθη αλεξανδρε ουδις ημερα,0.5979732938540573,21.88,25.0,20.0,1000.0,0.6,0.1,5.0,0.01,20.0,,,,,,,,,,,
142, τον αλεξανδρε ουδις θεος,0.5831234326464008,102.7,10.0,20.0,1000.0,0.9,0.05,10.0,0.001,100.0,,,,,,,,,,,
143, ινδικτιωνος αλεξανδρε ουδις εις,0.7751386943573911,103.6,15.0,200.0,500.0,0.6,0.01,1.0,0.01,100.0,,,,,,,,,,,
144, του αλεξανδρε ουδις ετους,0.8650988517195484,54.12,25.0,500.0,1000.0,0.6,0.01,1.0,0.01,50.0,,,,,,,,,,,
145, οι αλεξανδρε ουδις απο,0.7946180401501004,24.733333333333334,15.0,200.0,1000.0,0.1,0.01,1.0,0.001,20.0,,,,,,,,,,,
146, του αλεξανδρε ουδις ετους,0.8915153249382379,106.06666666666666,15.0,500.0,500.0,0.1,0.01,5.0,0.001,100.0,,,,,,,,,,,
137,,,,,,,,,,,,ετους αλεξανδρε ουδις και,0.9296461939249978,51.1,1000.0,500.0,0.6,0.0,5.0,10.0,0.1,50.0
138,,,,,,,,,,,,ουδις αλεξανδρε ουδις ουδις,0.9100854715154029,54.84,1000.0,500.0,0.1,0.1,0.0,25.0,0.01,50.0
139,,,,,,,,,,,,εχει αλεξανδρε ουδις παρα,0.6059897233570471,21.6,20.0,1000.0,0.6,0.05,0.0,10.0,0.01,20.0
140,,,,,,,,,,,,ετων αλεξανδρε ουδις δε,0.698152160693039,101.2,100.0,250.0,0.1,0.01,2.0,10.0,0.1,100.0
141,,,,,,,,,,,,εκτισθη αλεξανδρε ουδις ημερα,0.5979732938540573,21.88,20.0,1000.0,0.6,0.1,5.0,25.0,0.01,20.0
142,,,,,,,,,,,,τον αλεξανδρε ουδις θεος,0.5831234326464008,102.7,20.0,1000.0,0.9,0.05,10.0,10.0,0.001,100.0
143,,,,,,,,,,,,ινδικτιωνος αλεξανδρε ουδις εις,0.7751386943573911,103.6,200.0,500.0,0.6,0.0,1.0,15.0,0.01,100.0
144,,,,,,,,,,,,του αλεξανδρε ουδις ετους,0.8650988517195484,54.12,500.0,1000.0,0.6,0.01,0.0,25.0,0.01,50.0
145,,,,,,,,,,,,οι αλεξανδρε ουδις απο,0.7946180401501004,24.733333333333334,200.0,1000.0,0.1,0.01,1.0,15.0,0.001,20.0
